[
  {
    "id": "6Qq1q91q8iIPlI89qDq96bO8QDD0qOql",
    "name": "B4U",
    "nameKana": "B4U",
    "nameIndex": 11,
    "artist": "NAOKI",
    "series": "4thMIX",
    "minBPM": 155,
    "maxBPM": 155,
    "version": 20190320
  },
  {
    "id": "P8P1dlqi9D111iIDPOP0l9DIO1l6lqO9",
    "name": "BABY BABY GIMME YOUR LOVE",
    "nameKana": "BABY BABY GIMME YOUR LOVE",
    "nameIndex": 11,
    "artist": "DIVAS",
    "series": "4thMIX",
    "minBPM": 96,
    "maxBPM": 96,
    "version": 20190320
  },
  {
    "id": "ii6Oooool0IoOqi1qdDo96QIil6IoOq0",
    "name": "BURNIN' THE FLOOR",
    "nameKana": "BURNIN THE FLOOR",
    "nameIndex": 11,
    "artist": "NAOKI",
    "series": "4thMIX",
    "minBPM": 155,
    "maxBPM": 155,
    "version": 20190320
  },
  {
    "id": "ioi6db99oOPPDd1db888D6oi6bb06o0P",
    "name": "CAN'T STOP FALLIN' IN LOVE",
    "nameKana": "CANT STOP FALLIN IN LOVE",
    "nameIndex": 12,
    "artist": "NAOKI",
    "series": "4thMIX",
    "minBPM": 155,
    "maxBPM": 155,
    "version": 20190320
  },
  {
    "id": "i0bdP6II6dqb6lbQQ9q9OQq68i1qPddO",
    "name": "CELEBRATE NITE",
    "nameKana": "CELEBRATE NITE",
    "nameIndex": 12,
    "artist": "N.M.R",
    "series": "4thMIX",
    "minBPM": 144,
    "maxBPM": 144,
    "version": 20190320
  },
  {
    "id": "1q6obddbql8lQdPI19liD6PdQ0dPIODd",
    "name": "Don't Stop!～AMD 2nd MIX～",
    "nameKana": "DONT STOP AMD 2ND MIX",
    "nameIndex": 13,
    "artist": "Dr.VIBE feat. JP Miles",
    "series": "4thMIX",
    "minBPM": 130,
    "maxBPM": 130,
    "version": 20190320
  },
  {
    "id": "Q0OiPQQ8IbIDq08IO9Io0qDdoDPPdd1q",
    "name": "DROP OUT",
    "nameKana": "DROP OUT",
    "nameIndex": 13,
    "artist": "NW260",
    "series": "4thMIX",
    "minBPM": 260,
    "maxBPM": 260,
    "version": 20190320
  },
  {
    "id": "D81Pq66DQPiQdliqIPl0ioPOi9OlQoQ9",
    "name": "era (nostalmix)",
    "nameKana": "ERA NOSTALMIX",
    "nameIndex": 14,
    "artist": "TaQ",
    "series": "4thMIX",
    "minBPM": 90,
    "maxBPM": 180,
    "version": 20190320
  },
  {
    "id": "O1blDPOQ8IQb00o0D89QIDIlo8b06liD",
    "name": "HIGHER",
    "nameKana": "HIGHER",
    "nameIndex": 17,
    "artist": "NM feat. SUNNY",
    "series": "4thMIX",
    "minBPM": 132,
    "maxBPM": 132,
    "version": 20190320
  },
  {
    "id": "ODq019O9o1OPdq9PiPl0o8D8DQ8bid88",
    "name": "Holic",
    "nameKana": "HOLIC",
    "nameIndex": 17,
    "artist": "TaQ",
    "series": "4thMIX",
    "minBPM": 155,
    "maxBPM": 155,
    "version": 20190320
  },
  {
    "id": "8l808Do60DP0qDbD066QQqP1qOQdob90",
    "name": "HYSTERIA",
    "nameKana": "HYSTERIA",
    "nameIndex": 17,
    "artist": "NAOKI 190",
    "series": "4thMIX",
    "minBPM": 190,
    "maxBPM": 190,
    "version": 20190320
  },
  {
    "id": "8lDOiqP0biD8dD9lOQO619i1PqbqDiP8",
    "name": "LEADING CYBER",
    "nameKana": "LEADING CYBER",
    "nameIndex": 21,
    "artist": "dj TAKA",
    "series": "4thMIX",
    "minBPM": 150,
    "maxBPM": 150,
    "version": 20190320
  },
  {
    "id": "boOdPIqbDd8li0O0IqliPo1Doq99Ob09",
    "name": "LOVE AGAIN TONIGHT～For Melissa MIX～",
    "nameKana": "LOVE AGAIN TONIGHT FOR MELISSA MIX",
    "nameIndex": 21,
    "artist": "NAOKI feat. PAULA TERRY",
    "series": "4thMIX",
    "minBPM": 150,
    "maxBPM": 150,
    "version": 20190320
  },
  {
    "id": "6Ddo196olOPi9IQdbQ8Qbd8do8Q1obOD",
    "name": "MY SUMMER LOVE",
    "nameKana": "MY SUMMER LOVE",
    "nameIndex": 22,
    "artist": "MITSU-O! with GEILA",
    "series": "4thMIX",
    "minBPM": 100,
    "maxBPM": 100,
    "version": 20190320
  },
  {
    "id": "1d10660Dd0IOibDI890Ild80q6ddoQO8",
    "name": "ORION.78(AMeuro-MIX)",
    "nameKana": "ORION78 AMEURO MIX",
    "nameIndex": 24,
    "artist": "RE-VENGE",
    "series": "4thMIX",
    "minBPM": 105,
    "maxBPM": 105,
    "version": 20190320
  },
  {
    "id": "DPQo8Q0l9D8IPiDiq11l8OI6i11OOb6O",
    "name": "PARANOIA EVOLUTION",
    "nameKana": "PARANOIA EVOLUTION",
    "nameIndex": 25,
    "artist": "200",
    "series": "4thMIX",
    "minBPM": 200,
    "maxBPM": 200,
    "version": 20190320
  },
  {
    "id": "60QoP9DoIo90D616989Q0D0iodOoOd91",
    "name": "SEXY PLANET",
    "nameKana": "SEXY PLANET",
    "nameIndex": 28,
    "artist": "Crystal Aliens",
    "series": "4thMIX",
    "minBPM": 180,
    "maxBPM": 180,
    "version": 20190320
  },
  {
    "id": "88do8dl8O6Ql1Qlb981lOi8D86oiq91P",
    "name": "SUPER STAR",
    "nameKana": "SUPER STAR",
    "nameIndex": 28,
    "artist": "D.J.RICH feat. TAILBROS.",
    "series": "4thMIX",
    "minBPM": 128,
    "maxBPM": 128,
    "version": 20190320
  },
  {
    "id": "D81D8689llDiOqPq0IP19bbQQiioPl8d",
    "name": "TRIP MACHINE CLIMAX",
    "nameKana": "TRIP MACHINE CLIMAX",
    "nameIndex": 29,
    "artist": "DE-SIRE",
    "series": "4thMIX",
    "minBPM": 180,
    "maxBPM": 180,
    "version": 20190320
  },
  {
    "id": "01808Q1Q6lQQ1lP0qd80I0b0qqDd1OOP",
    "name": "WILD RUSH",
    "nameKana": "WILD RUSH",
    "nameIndex": 32,
    "artist": "FACTOR-X",
    "series": "4thMIX",
    "minBPM": 80,
    "maxBPM": 180,
    "version": 20190320
  },
  {
    "id": "IQ0dIiDql9Q68d9ddQIiQbq1OPq8Db69",
    "name": ".59",
    "nameKana": ".59",
    "nameIndex": 36,
    "artist": "dj TAKA",
    "series": "4thMIX",
    "minBPM": 135,
    "maxBPM": 135,
    "version": 20190320
  }
]
