[
  {
    "id": "l9lq19DdiD8qQPoPOlboi1qQii0IQI86",
    "name": "革命",
    "nameKana": "かくめい",
    "nameIndex": 1,
    "artist": "dj TAKA with NAOKI",
    "series": "DDRMAX2",
    "minBPM": 83,
    "maxBPM": 148,
    "version": 20191109
  },
  {
    "id": "DdO1iboqI6980Q6QPD9P1PbQQ88I16lq",
    "name": "AFRONOVA(FROM NONSTOP MEGAMIX)",
    "nameKana": "AFRONOVA FROM NONSTOP MEGAMIX",
    "nameIndex": 10,
    "artist": "RE-VENGE",
    "series": "DDRMAX2",
    "minBPM": 200,
    "maxBPM": 200,
    "version": 20191109
  },
  {
    "id": "808dq8OIq16PP19i1bP0IDP1OqPOlo6q",
    "name": "AM-3P(AM EAST mix)",
    "nameKana": "AM 3P AM EAST MIX",
    "nameIndex": 10,
    "artist": "KTz",
    "series": "DDRMAX2",
    "minBPM": 140,
    "maxBPM": 140,
    "version": 20191109
  },
  {
    "id": "POIDil00didIo98D10loIObibPOob88O",
    "name": "B4U(B4 ZA BEAT MIX)",
    "nameKana": "B4U B4 ZA BEAT MIX",
    "nameIndex": 11,
    "artist": "NAOKI",
    "series": "DDRMAX2",
    "minBPM": 170,
    "maxBPM": 170,
    "version": 20191109
  },
  {
    "id": "bqQ1OQDidQD8QbIqql06O6o1QD6oOodP",
    "name": "BRE∀K DOWN!",
    "nameKana": "BREAK DOWN",
    "nameIndex": 11,
    "artist": "BeForU",
    "series": "DDRMAX2",
    "minBPM": 190,
    "maxBPM": 190,
    "version": 20191109
  },
  {
    "id": "i18OPo6l8Q6bo9q0qP6889IDqoP8O0Qq",
    "name": "BRILLIANT 2U(K.O.G G3 MIX)",
    "nameKana": "BRILLIANT 2U KOG G3 MIX",
    "nameIndex": 11,
    "artist": "NAOKI",
    "series": "DDRMAX2",
    "minBPM": 170,
    "maxBPM": 170,
    "version": 20191109
  },
  {
    "id": "QdbPPPDlIQiI191qPdblO01O8P8o6D68",
    "name": "BURNIN' THE FLOOR (BLUE FIRE mix)",
    "nameKana": "BURNIN THE FLOOR BLUE FIRE MIX",
    "nameIndex": 11,
    "artist": "NAOKI",
    "series": "DDRMAX2",
    "minBPM": 155,
    "maxBPM": 155,
    "version": 20191109
  },
  {
    "id": "i86qD6Pl61dPI0Q9db1P8bl1ii99q1lD",
    "name": "BURNING HEAT! (3 Option MIX)",
    "nameKana": "BURNING HEAT 3 OPTION MIX",
    "nameIndex": 11,
    "artist": "Mr.T with Motoaki. F",
    "series": "DDRMAX2",
    "minBPM": 166,
    "maxBPM": 166,
    "version": 20191109
  },
  {
    "id": "1Qqo9bID18OdiI1Qb0lP9DIqIO6ldPOP",
    "name": "CANDY♥",
    "nameKana": "CANDY HEART",
    "nameIndex": 12,
    "artist": "小坂りゆ",
    "series": "DDRMAX2",
    "minBPM": 180,
    "maxBPM": 180,
    "version": 20191109
  },
  {
    "id": "O6q1o06Po9lQbqOl08Io1obqQ9QPi09b",
    "name": "CELEBRATE NITE(EURO TRANCE STYLE)",
    "nameKana": "CELEBRATE NITE EURO TRANCE STYLE",
    "nameIndex": 12,
    "artist": "N.M.R",
    "series": "DDRMAX2",
    "minBPM": 144,
    "maxBPM": 144,
    "version": 20191109
  },
  {
    "id": "iQo0QOoI6bOPQlbb9ldOo9lbdD1idiOO",
    "name": "D2R",
    "nameKana": "D2R",
    "nameIndex": 13,
    "artist": "NAOKI",
    "series": "DDRMAX2",
    "minBPM": 160,
    "maxBPM": 160,
    "version": 20191109
  },
  {
    "id": "98q8616ddDIqdo1dbqbO0Po96oldo1Oo",
    "name": "DESTINY",
    "nameKana": "DESTINY",
    "nameIndex": 13,
    "artist": "NAOKI feat. PAULA TERRY",
    "series": "DDRMAX2",
    "minBPM": 155,
    "maxBPM": 155,
    "version": 20191109
  },
  {
    "id": "8Pb6oPdbO6lo8lbiQ181IDidI9ll8q80",
    "name": "DIVE TO THE NIGHT",
    "nameKana": "DIVE TO THE NIGHT",
    "nameIndex": 13,
    "artist": "小坂りゆ",
    "series": "DDRMAX2",
    "minBPM": 155,
    "maxBPM": 155,
    "version": 20191109
  },
  {
    "id": "d0P01d9q8oOd8OP1bQPoqlq96906PqPD",
    "name": "DROP OUT(FROM NONSTOP MEGAMIX)",
    "nameKana": "DROP OUT FROM NONSTOP MEGAMIX",
    "nameIndex": 13,
    "artist": "NW260",
    "series": "DDRMAX2",
    "minBPM": 130,
    "maxBPM": 130,
    "version": 20191109
  },
  {
    "id": "Dd6lP00DPqIb0d6iqOdlO08l69l6q1di",
    "name": "ECSTASY (midnight blue mix)",
    "nameKana": "ECSTASY MIDNIGHT BLUE MIX",
    "nameIndex": 14,
    "artist": "d-complex",
    "series": "DDRMAX2",
    "minBPM": 145,
    "maxBPM": 145,
    "version": 20191109
  },
  {
    "id": "8DQDq16PPlli6o9iDl11DqooqOPlOb08",
    "name": "HIGHER (next morning mix)",
    "nameKana": "HIGHER NEXT MORNING MIX",
    "nameIndex": 17,
    "artist": "NM feat. SUNNY",
    "series": "DDRMAX2",
    "minBPM": 132,
    "maxBPM": 132,
    "version": 20191109
  },
  {
    "id": "lPloI86odlIbIo96P169b9I0Ob8lD189",
    "name": "HYSTERIA 2001",
    "nameKana": "HYSTERIA 2001",
    "nameIndex": 17,
    "artist": "NM",
    "series": "DDRMAX2",
    "minBPM": 190,
    "maxBPM": 190,
    "version": 20191109
  },
  {
    "id": "DddIPd6iId8Doqq8OibDlD1dOi8PO8o9",
    "name": "i feel ...",
    "nameKana": "I FEEL",
    "nameIndex": 18,
    "artist": "AKIRA YAMAOKA",
    "series": "DDRMAX2",
    "minBPM": 141,
    "maxBPM": 141,
    "version": 20191109
  },
  {
    "id": "lObPDQDI08DoodDq1061IP1qbQ1qQQbl",
    "name": "MAXX UNLIMITED",
    "nameKana": "MAXX UNLIMITED",
    "nameIndex": 22,
    "artist": "Z",
    "series": "DDRMAX2",
    "minBPM": 140,
    "maxBPM": 320,
    "version": 20191109
  },
  {
    "id": "d99P0I1i960QO0oolD6oQIO8OObO9Plb",
    "name": "MY SUMMER LOVE(TOMMY'S SMILE MIX)",
    "nameKana": "MY SUMMER LOVE TOMMYS SMILE MIX",
    "nameIndex": 22,
    "artist": "MITSU-O! with GEILA",
    "series": "DDRMAX2",
    "minBPM": 100,
    "maxBPM": 100,
    "version": 20191109
  },
  {
    "id": "Qo9l6l6lq0q618bQOb8d6qiooiiPQqoI",
    "name": "rain of sorrow",
    "nameKana": "RAIN OF SORROW",
    "nameIndex": 27,
    "artist": "NM feat. EBONY FAY",
    "series": "DDRMAX2",
    "minBPM": 140,
    "maxBPM": 140,
    "version": 20191109
  },
  {
    "id": "Db9D6Old6lIo01q0qlQ0dD1oDdbdob8I",
    "name": "Secret Rendez-vous",
    "nameKana": "SECRET RENDEZ VOUS",
    "nameIndex": 28,
    "artist": "DIVAS",
    "series": "DDRMAX2",
    "minBPM": 98,
    "maxBPM": 98,
    "version": 20191109
  },
  {
    "id": "O06Id8PIDbDblO109ddi1dldd0bqDdQ1",
    "name": "SEXY PLANET(FROM NONSTOP MEGAMIX)",
    "nameKana": "SEXY PLANET FROM NONSTOP MEGAMIX",
    "nameIndex": 28,
    "artist": "Crystal Aliens",
    "series": "DDRMAX2",
    "minBPM": 180,
    "maxBPM": 180,
    "version": 20191109
  },
  {
    "id": "oio6bqP08PPoP9qIq1oi9Dib9PIq9l11",
    "name": "Silent Hill (3rd christmas mix)",
    "nameKana": "SILENT HILL 3RD CHRISTMAS MIX",
    "nameIndex": 28,
    "artist": "THOMAS HOWARD",
    "series": "DDRMAX2",
    "minBPM": 125,
    "maxBPM": 125,
    "version": 20191109
  },
  {
    "id": "DOOb99dlP8PdIbDOQIqoqll60Iob9189",
    "name": "STILL IN MY HEART (MOMO MIX)",
    "nameKana": "STILL IN MY HEART MOMO MIX",
    "nameIndex": 28,
    "artist": "NAOKI",
    "series": "DDRMAX2",
    "minBPM": 85,
    "maxBPM": 170,
    "version": 20191109
  },
  {
    "id": "0qQ1odlooiQO99DDP6bD9bOq89669PQb",
    "name": "SUPER STAR(FROM NONSTOP MEGAMIX)",
    "nameKana": "SUPER STAR FROM NONSTOP MEGAMIX",
    "nameIndex": 28,
    "artist": "D.J.RICH feat. TAILBROS.",
    "series": "DDRMAX2",
    "minBPM": 128,
    "maxBPM": 128,
    "version": 20191109
  },
  {
    "id": "8809ol0qbbd6919bbl0b8id1669PqQ08",
    "name": "Sweet Sweet ♥ Magic",
    "nameKana": "SWEET SWEET LOVE MAGIC",
    "nameIndex": 28,
    "artist": "jun",
    "series": "DDRMAX2",
    "minBPM": 180,
    "maxBPM": 180,
    "version": 20191109
  },
  {
    "id": "io688qld6Pqq6bI01q86illP18biq0bd",
    "name": "TSUGARU",
    "nameKana": "TSUGARU",
    "nameIndex": 29,
    "artist": "RevenG vs DE-SIRE",
    "series": "DDRMAX2",
    "minBPM": 165,
    "maxBPM": 165,
    "version": 20191109
  },
  {
    "id": "1qDD1DdPlId69010IQ18I6q8Q00IoI6D",
    "name": "TSUGARU (APPLE MIX)",
    "nameKana": "TSUGARU APPLE MIX",
    "nameIndex": 29,
    "artist": "RevenG vs DE-SIRE",
    "series": "DDRMAX2",
    "minBPM": 165,
    "maxBPM": 165,
    "version": 20191109
  },
  {
    "id": "ibOQ0QOdIPdIbIo0oPoDDI1DqPId00li",
    "name": "WILD RUSH(FROM NONSTOP MEGAMIX)",
    "nameKana": "WILD RUSH FROM NONSTOP MEGAMIX",
    "nameIndex": 32,
    "artist": "FACTOR-X",
    "series": "DDRMAX2",
    "minBPM": 125,
    "maxBPM": 125,
    "version": 20191109
  }
]
