[
  {
    "id": "8Il6980di8P89lil1PDIqqIbiq1QO8lQ",
    "name": "MAKE IT BETTER",
    "nameKana": "MAKE IT BETTER",
    "nameIndex": 22,
    "artist": "mitsu-O!",
    "series": "1st",
    "minBPM": 119,
    "maxBPM": 119,
    "version": 20190320
  },
  {
    "id": "06loOQ0DQb0DqbOibl6qO81qlIdoP9DI",
    "name": "PARANOiA",
    "nameKana": "PARANOIA",
    "nameIndex": 25,
    "artist": "180",
    "series": "1st",
    "minBPM": 180,
    "maxBPM": 180,
    "version": 20190320
  },
  {
    "id": "Pb9II0oiI9ODQ8OP8IqIPQP9P68biqIi",
    "name": "TRIP MACHINE",
    "nameKana": "TRIP MACHINE",
    "nameIndex": 29,
    "artist": "DE-SIRE",
    "series": "1st",
    "minBPM": 160,
    "maxBPM": 160,
    "version": 20190320
  }
]
